{
  "binding_type": "policy_runtime_abi_binding_v1",
  "binding_version": "1.0.0",
  "policy_interface_id": "policy-runtime-phase3-001",
  "input_schema_ref": "schemas/core/effective_policy_projection_v1.schema.json",
  "output_schema_ref": "schemas/core/proof_finality_v1.schema.json",
  "created_at": "2026-03-19T05:07:00Z"
}
